IdBibliografia,Autore,Titolo,ISBN,new_authors,new_identifier
684,Poggiali C.,Memorie storiche di Piacenza compilate dal preposto Cristoforo Poggiali bibliotecario di S.A.R.. V,,['Cristoforo Poggiali'],"[{'type': 'OTHER', 'identifier': 'BML:37001102073447'}]"
685,Fanti M.,Ville castelli e chiese bolognesi da un libro di disegni del Cinquecento,,,"[{'type': 'OTHER', 'identifier': 'OCLC:956185266'}]"
686,Fornasini G.,Il castello di Monterenzio,,['Giuseppe Fornasini'],"[{'type': 'OTHER', 'identifier': 'OCLC:964271475'}]"
687,Foschi P.,Borghi e castelli nella valle del Samoggia nei secoli X-XIV,,['Paola Foschi'],"[{'type': 'OTHER', 'identifier': 'UOM:39015079166677'}]"
688,Foschi P.,"Insediamento, popolamento ed economia nell'alta valle del Limentra di Treppio?: Bargi",,,"[{'type': 'OTHER', 'identifier': 'OCLC:886996560'}]"
689,Foschi P.,"Insediamento, popolamento ed economia nell'alta valle del Limentra di Treppio?: Savignano Lungoreno",,,
690,Foschi P.,La famiglia dei conti di Panico: una mancata signoria interregionale,,,"[{'type': 'OTHER', 'identifier': 'UOM:39015041018774'}]"
692,Mazzotti M.,La pergamena del 783,,"['Currado Curradi', 'Mario Mazzotti']","[{'type': 'OTHER', 'identifier': 'UOM:39015039773778'}]"
693,Mengozzi M.,L'archivio della diocesi di Sarsina,,['Giuseppe Mazzatinti'],"[{'type': 'OTHER', 'identifier': 'ONB:+Z32918180X'}]"
694,Merlini F.,"""Castrum Ligori"" feudo scomparso fra Bubano e Selice",,['Edoardo Manarini'],"[{'type': 'ISBN_13', 'identifier': '9788867054541'}, {'type': 'ISBN_10', 'identifier': '8867054546'}]"
695,Merlini F.,1177: Federico Barbarossa passò l'inverno a Mordano,,['Edoardo Manarini'],"[{'type': 'ISBN_13', 'identifier': '9788867054541'}, {'type': 'ISBN_10', 'identifier': '8867054546'}]"
696,Pasquali G.,Contadini e signori della bassa: insediamenti e deserta del Ravennate e del Ferrarese nel Medioevo,8880912666,['Gianfranco Pasquali'],"[{'type': 'OTHER', 'identifier': 'UVA:X006040396'}]"
697,Pelicelli N.,Salsomaggiore e dintorni,,['Nestore Pelicelli'],"[{'type': 'OTHER', 'identifier': 'OCLC:636335172'}]"
698,Pellegri M.,Il castello di Bernabò Visconti,,['Angelo Berenzi'],"[{'type': 'OTHER', 'identifier': 'OCLC:878272059'}]"
699,Pellegrini A.,La dominazione degli Estensi a Pieve di Cento,,['Amedeo Pellegrini'],"[{'type': 'OTHER', 'identifier': 'OCLC:1405094927'}]"
700,Botti F.,"Collecchio, Sala Baganza, Felino e loro frazioni",,['Ferruccio Botti'],"[{'type': 'OTHER', 'identifier': 'OCLC:897984162'}]"
701,Brentani A.,Tredozio sotto la dominazione dei conti Guidi. L'ultimo conte di Tredozio,,"['Paola Foschi', 'Renzo Zagnoni']","[{'type': 'OTHER', 'identifier': 'UOM:39015061767011'}]"
702,Brian A.,Guida per escursioni nell'Appennino parmense,,['Alessandro Brian'],"[{'type': 'OTHER', 'identifier': 'UIUC:30112074839173'}]"
703,Artocchini C.,Piacenza e le sue fortificazioni,,['Lorenzo Molossi'],"[{'type': 'OTHER', 'identifier': 'BSB:BSB10078868'}]"
705,"Bellei S., Rovatti E.",Castelli Modenesi della Montagna,,['Girolamo Tiraboschi'],"[{'type': 'OTHER', 'identifier': 'BSB:BSB10052531'}]"
706,Benati A.,"La storia antica di Granaglione: vita politica, civile e istituzionale di un comune montano",,['Autori Vari'],"[{'type': 'ISBN_13', 'identifier': '9791254698037'}]"
707,Benati A.,Labante e la valle dell'Aneva,,"['Aniceto Antilopi', 'Bill Homes', 'Renzo Zagnoni']","[{'type': 'OTHER', 'identifier': 'UVA:X004617313'}]"
708,Benati A.,Per la storia dei possessi matildici nell'Appennino bolognese,,['Amedeo Benati'],"[{'type': 'OTHER', 'identifier': 'OCLC:879043796'}]"
709,Benati A.,Per la storia dei possessi matildici nell'Appennino bolognese-imolese,,['Amedeo Benati'],"[{'type': 'OTHER', 'identifier': 'OCLC:879046132'}]"
710,Benati A.,Per la storia dei possessi matildici: Medicina e Argelata,,['Amedeo Benati'],"[{'type': 'OTHER', 'identifier': 'OCLC:1277410174'}]"
711,"Simeoni L., Vicini E. P.",Registrum Privilegiorum Comunis Mutine,,['Pierpaolo Bonacini'],"[{'type': 'OTHER', 'identifier': 'UOM:39015060581298'}]"
712,Cattinari R.,Testimonianze artistiche quattrocentesche nel castello di Formigine,,['Pierpaolo Bonacini'],"[{'type': 'OTHER', 'identifier': 'STANFORD:36105024363157'}]"
713,Sardi G.,Historie ferraresi,,['Gasparo Sardi'],"[{'type': 'OTHER', 'identifier': 'BSB:BSB10162122'}]"
714,Salviati I.,Cronica dall'anno 1398 al 1411,,['Francesco Zambrini'],"[{'type': 'OTHER', 'identifier': 'HARVARD:32044011421757'}]"
715,Montanari L.,La torre dei Conti Gucci-Boschi,,"['Imola (Italy). Mostra delle rocche di Romagna', 'Fausto Mancini']","[{'type': 'OTHER', 'identifier': 'STANFORD:36105032650801'}]"
716,Monatanari M.,Imola e S. Cassiano: una città e un castello in lotta per il predominio nei secc. XI-XII,8886123086,['Massimo Montanari'],"[{'type': 'ISBN_10', 'identifier': '8886123086'}, {'type': 'ISBN_13', 'identifier': '9788886123082'}]"
717,Montagna E.,La demolizione delle mura e dei bastioni della Mirandola,,['Euro Montagna'],"[{'type': 'OTHER', 'identifier': 'OCLC:1202282109'}]"
718,Montenovesi A.,Documenti pergamenacei di Romagna nel R. Archivio di Stato di Roma,,"['Archivio di Stato di Roma', 'Armando Lodolini']","[{'type': 'OTHER', 'identifier': 'UOM:39015014634045'}]"
719,Morgante M.,Filippo da Pistoia arcivescovo di Ravenna (1190-1270),,['Marcello Morgante'],"[{'type': 'OTHER', 'identifier': 'OCLC:878208304'}]"
720,Morini G.,Stradario storico di Ravenna,,['Giuseppe Morini'],"[{'type': 'OTHER', 'identifier': 'OCLC:1277474905'}]"
721,Mucci P.,Il plebanato di Trebbio e le rocche dei Malatighi. Appunti per la storia del territorio,,,
722,Muratori L. A.,Annali d'Italia. Dal principio dell'era volgare sino all'anno MDCCXLIX,,['Lodovico Antonio Muratori'],"[{'type': 'OTHER', 'identifier': 'OCLC:913445872'}]"
723,Boselli G. V.,Delle storie piacentine libri XII,,['Giovanni Vincenzo BOSELLI'],"[{'type': 'OTHER', 'identifier': 'BL:A0017986765'}]"
724,Boselli G. V.,Storie Piacentine,,['Boselli'],"[{'type': 'OTHER', 'identifier': 'UBBS:UBBS-00011225'}]"
725,Boselli G. V.,Delle storie piacentine libri XII,,['Giovanni Vincenzo BOSELLI'],"[{'type': 'OTHER', 'identifier': 'BL:A0017986765'}]"
726,Boselli G. V.,Delle storie piacentine libri XII,,['Giovanni Vincenzo BOSELLI'],"[{'type': 'OTHER', 'identifier': 'BL:A0017986765'}]"
727,Boselli G. V.,Delle storie piacentine libri XII,,['Giovanni Vincenzo BOSELLI'],"[{'type': 'OTHER', 'identifier': 'BL:A0017986765'}]"
728,Bernicoli S.,Le torri della città e del territorio di Ravenna,,['Silvio Bernicoli'],"[{'type': 'OTHER', 'identifier': 'OCLC:955756309'}]"
729,Tommasini R.,"Fultignano, Castelvecchio, Crepacorio, Allegralcore: ricostruzioni",,,"[{'type': 'OTHER', 'identifier': 'UOM:39015066781926'}]"
730,Torre A.,Un episodio delle relazioni fra Bologna e Venezia nella seconda metà del secolo XIII,,['Pierpaolo Bonacini'],"[{'type': 'OTHER', 'identifier': 'UOM:39015062881720'}]"
731,Capelli G.,Castelli di Parma. Rocche e torri dall'Appennino al Po,,['Gianni Capelli'],"[{'type': 'OTHER', 'identifier': 'OCLC:45760468'}]"
732,Carpani G.,I castelli dei Visconti a Bologna,,['Albano Sorbelli'],"[{'type': 'OTHER', 'identifier': 'UVA:X001108198'}]"
733,,"Storia di Cervia. II, Il Medio Evo",,,"[{'type': 'OTHER', 'identifier': 'IBNR:CR102015985'}]"
734,,"Storia di Cervia. III.1, L'età moderna",,['Arcangelo Mafrici'],"[{'type': 'ISBN_13', 'identifier': '9788849277166'}, {'type': 'ISBN_10', 'identifier': '8849277164'}]"
735,,Storia di Cesena. II. Il Medioevo. 1 (secoli VI-XIV),,"['Sauro Gelichi', 'Claudio Negrelli']","[{'type': 'ISBN_13', 'identifier': '9788878143838'}, {'type': 'ISBN_10', 'identifier': '8878143839'}]"
736,,Storia di Cesena. II. Il Medioevo. 2 (secoli XIV-XV),,['Augusto Vasina'],"[{'type': 'OTHER', 'identifier': 'UVA:X001787414'}]"
737,,Storia di Cesena. III. La dominazione pontificia (secoli XIV-XVII-XVIII),,['Elena Baldini'],"[{'type': 'OTHER', 'identifier': 'UOM:39015058231484'}]"
738,,"Storia di Ravenna. III, Dal Mille alla fine della signoria polentana",8831756796,,"[{'type': 'OTHER', 'identifier': 'UGA:32108026057714'}]"
739,"Fabbri L., Pirillo P.",Romagna toscana,,"['Giovanni Mini', 'Pompeo Nadiani']","[{'type': 'OTHER', 'identifier': 'OCLC:700315517'}]"
740,Micheli A.,Il castello di Gallinella,,['Mattia Muli'],"[{'type': 'ISBN_13', 'identifier': '9788867829033'}, {'type': 'ISBN_10', 'identifier': '8867829033'}]"
741,Micheli A.,Il comune di Mariano e Castelcorniglio,,,"[{'type': 'OTHER', 'identifier': 'IBNR:CR300074625'}]"
742,Micheli G.,Il viaggio del Capitano Antonio Boccia nell'Appennino Parmense,,['Roberto Lasagni'],"[{'type': 'OTHER', 'identifier': 'UOM:39015049475471'}]"
743,Micheli G.,L'alta valle del Parma nelle carte del decimo secolo,,['Giuseppe Micheli'],"[{'type': 'OTHER', 'identifier': 'OCLC:878200800'}]"
745,Micheli G.,"Statuti Montanari. Borgotaro, Bardi e Compiano, Berceto, Corniglio, Calestano, Ravarano, Tizzano, Ri",,,"[{'type': 'OTHER', 'identifier': 'CORNELL:31924071204741'}]"
746,"Messori P., Dotti Messori G.",La rocca di Montese: indagine storica relativa al fortilizio di Montese,,,"[{'type': 'OTHER', 'identifier': 'UCAL:B3724508'}]"
747,Milani G.,Lotta di fazione e comunità montane nella documentazione giudiziaria bolognese,,['Paolo Pirillo'],"[{'type': 'ISBN_13', 'identifier': '9788883345340'}, {'type': 'ISBN_10', 'identifier': '8883345347'}]"
749,Pacciani R.,Da rocca cittadina a residenza europea: forme e mutazioni del principale insediamento estense a Modena,,,"[{'type': 'OTHER', 'identifier': 'UCLA:L0070427620'}]"
750,Padovani A.,"""Iudicaria motinensis"". Contributo allo studio del territorio bolognese nel Medioevo",,['Andrea Padovani'],"[{'type': 'OTHER', 'identifier': 'OCLC:849413840'}]"
751,Pagella E.,Per la storia del castello di Formigine. Tre inventari dell'archivio Calcagnini,,['Pierpaolo Bonacini'],"[{'type': 'OTHER', 'identifier': 'STANFORD:36105024363157'}]"
752,"Palazzi G., Reggiani N.","Il disegno della terra di Nonantola: cartografia storica, secoli XVI-XVIII",,"['Giovanna Palazzi', 'Natascia Reggiani']","[{'type': 'OTHER', 'identifier': 'UOM:39015051833633'}]"
753,Palmieri A.,Feudatari e popolo della montagna bolognese: periodo comunale,,['Fulvio Maroi'],"[{'type': 'OTHER', 'identifier': 'OCLC:1403587753'}]"
754,Palmieri A.,Gli antichi vicariati dell'appennino bolognese,,['Arturo Palmieri'],"[{'type': 'OTHER', 'identifier': 'OCLC:881752248'}]"
755,Pancino C.,Conselice di Romagna: l'infelice situazione: 1084-1810,8880630377,['Claudia Pancino'],"[{'type': 'ISBN_10', 'identifier': '8880630377'}, {'type': 'ISBN_13', 'identifier': '9788880630371'}]"
756,Pari S.,La signoria di Malatesta da Verucchio,,['Silvia Pari'],"[{'type': 'OTHER', 'identifier': 'UOM:39015048844230'}]"
757,,Fonti della storia forlivese: cronaca di Sebastiano Menzocchi,,['Sebastiano Menzocchi'],"[{'type': 'OTHER', 'identifier': 'OCLC:963521206'}]"
758,Pasolini G.,"Giuseppe Pasolini, 1815-1876: memorie raccolte da suo figlio",,"['Pietro Desiderio Pasolini', 'Giuseppe Pasolini']","[{'type': 'OTHER', 'identifier': 'OCLC:485086280'}]"
759,Pasolini P. D.,Caterina Sforza,,['Pier Desiderio Pasolini'],"[{'type': 'OTHER', 'identifier': 'BSB:BSB11572872'}]"
760,Pasolini P. D.,Ravenna e le sue grandi memorie,,['conte Pier Desiderio Pasolini'],"[{'type': 'OTHER', 'identifier': 'WISC:89100138403'}]"
761,Diaconi P.,Historia Langobardorum. Continuatio tertia,,"['Pablo Diácono', 'Pedro P. Herrera Roldán']","[{'type': 'ISBN_10', 'identifier': '8498280729'}, {'type': 'ISBN_13', 'identifier': '9788498280722'}]"
762,Pellegri M.,Il castello di San Secondo nella storia e nell'arte,,['Niccola Gabiani'],"[{'type': 'OTHER', 'identifier': 'COLUMBIA:AR51957094'}]"
763,Pellegri M.,"Strade, Chiese, Castelli nel territorio fra Felino e Langhirano a partire dalle origini al 1400",,,"[{'type': 'OTHER', 'identifier': 'UCAL:$B518983'}]"
764,Pellegrini M.,Congiure di Romagna: Lorenzo de' Medici e il duplice tirannicidio a Forlì e a Faenza nel 1488,8822247094,['Marco Pellegrini'],"[{'type': 'OTHER', 'identifier': 'UOM:39015042767759'}]"
765,Racine P.,Dalla dominazione longobarda all'anno mille,,['Pierre Racine'],"[{'type': 'OTHER', 'identifier': 'OCLC:493002534'}]"
766,Pini A. I.,"Un ""borgofranco"" bolognese nel Medioevo: il castello di Scaricalasino nel territorio di Monghidoro",,"['Deputazione di storia patria per le provincie di Romagna, Bologna']","[{'type': 'OTHER', 'identifier': 'UVA:X030707756'}]"
767,Pini A. I.,Il comune di Ravenna fra episcopio e aristocrazia cittadina,8831756796,['Raffaele Savigni'],"[{'type': 'OTHER', 'identifier': 'UOM:39015040753173'}]"
768,Pini A. I.,Un castello di secolare frontiera: Bazzano da villaggio fortificato a rocca signorile,,,"[{'type': 'OTHER', 'identifier': 'NWU:35556034717421'}]"
769,Pirondini M.,L'antica rocca di Sassuolo,8885650007,"['Accademia di scienze, lettere e arti']","[{'type': 'OTHER', 'identifier': 'ONB:+Z317200401'}]"
770,"Rambaldi B., da Imola",Benvenuto Rambaldi da Imola. Illustrato nella vita e nelle opere e di lui commento latino sulla Divina Commedia di Dante Alighieri,,['Benvenutus (de Imola)'],"[{'type': 'OTHER', 'identifier': 'STANFORD:36105000257746'}]"
771,Politi U.,I porti di Ravenna dall'antichità ad oggi: cenno storico,,['Giovanni Mesini'],"[{'type': 'OTHER', 'identifier': 'NYPL:33433046152736'}]"
772,Polloni A.,Toponomastica Romagnola,,['Antonio Polloni'],"[{'type': 'OTHER', 'identifier': 'UOM:39015066216782'}]"
773,Porisini C.,Mordano e Bubano nela storia,,['Cesare Porisini'],"[{'type': 'OTHER', 'identifier': 'OCLC:955972683'}]"
774,Presi D.,Il castello di Casio,,['Renzo Zagnoni'],"[{'type': 'OTHER', 'identifier': 'OCLC:963879225'}]"
775,Quadri L.,Memorie per la storia di Massa Lombarda,,['Luigi Quadri'],"[{'type': 'OTHER', 'identifier': 'UCAL:$B515987'}]"
776,Quaranta E.,La rocca di Soragna: itinerario e cenni storici,,['Emanuela Kretzulesco-Quaranta'],"[{'type': 'OTHER', 'identifier': 'OCLC:797878898'}]"
777,Racine P.,Alberto Scotto e la fondazione di castel San Giovanni,,,"[{'type': 'OTHER', 'identifier': 'UCLA:L0066437385'}]"
778,Racine P.,Una nuova nobiltà,,['Federico Del Tredici'],"[{'type': 'ISBN_13', 'identifier': '9788891758484'}, {'type': 'ISBN_10', 'identifier': '8891758485'}]"
779,Racine P.,Il declino della mercatura piacentina. Dagli orizzonti internazionali a quelli regionali,,['Autori Vari'],"[{'type': 'ISBN_13', 'identifier': '9788833130491'}, {'type': 'ISBN_10', 'identifier': '8833130495'}]"
780,Ragazzini V.,Modigliana e i conti Guidi in un lodo arbitrale del secolo XIII,,['Vittorio Ragazzini'],"[{'type': 'OTHER', 'identifier': 'OCLC:457453137'}]"
781,Poggiali C.,Memorie storiche di Piacenza compilate dal preposto Cristoforo Poggiali bibliotecario di S.A.R.,,['Cristoforo Poggiali'],"[{'type': 'OTHER', 'identifier': 'BML:37001102073447'}]"
782,Poggiali C.,Memorie storiche di Piacenza compilate dal preposto Cristoforo Poggiali bibliotecario di S.A.R.. VII,,['Cristoforo Poggiali'],"[{'type': 'OTHER', 'identifier': 'BML:37001102073447'}]"
783,Poggiali C.,Memorie storiche di Piacenza compilate dal preposto Cristoforo Poggiali bibliotecario di S.A.R.. VIII,,['Cristoforo Poggiali'],"[{'type': 'OTHER', 'identifier': 'BML:37001102073447'}]"
784,Calzolari M.,"Il territorio mirandolese nel XIII sec.: le curie, i ""castelli"" e i beni comuni dei figli di Manfredi",,['Augustin Calmet'],"[{'type': 'OTHER', 'identifier': 'ONB:+Z171243509'}]"
785,Carreri F.,Memorie storiche dei diritti e delle giurisdizioni dell'abbazia di S. Pietro di Modena,,['Ferruccio Carlo Carreri'],"[{'type': 'OTHER', 'identifier': 'OCLC:876304558'}]"
786,Casamorata C.,Saggi di geografia storica: le mappe forlivesi del Padre Coronelli: contributo alla cartografia storica,,['Cesare Casamorata'],"[{'type': 'OTHER', 'identifier': 'OCLC:57203599'}]"
787,Cerchiari G.,Ristretto storico della città di Imola: diviso in tre parti,,['Giulio Cesare Cerchiari'],"[{'type': 'OTHER', 'identifier': 'IBNR:CR102014978'}]"
788,Ferro G. F.,Istoria dell'antica città di Comacchio scritta dal dottor Gio. Francesco Ferro comacchiese,,['Giovanni Francesco Ferro'],"[{'type': 'OTHER', 'identifier': 'IBNF:CF005710316'}]"
789,Fiori G.,I castelli di Montecanino e Piozzano,,['Claudio Bonora'],"[{'type': 'ISBN_13', 'identifier': '9788848813051'}, {'type': 'ISBN_10', 'identifier': '8848813054'}]"
790,Fontana V.,De instauratione Urbis Ravennae: architettura e urbanistica durante la dominazione veneziana. Atti del Convegno tenuto a Ravenna,,,"[{'type': 'OTHER', 'identifier': 'STANFORD:36105010481088'}]"
791,Foschi P.,La valle dell'Idice in età Medievale. Paesaggio ? La tarda età comunale (secolo XIV),,"['Attilio Bartoli Langeli', 'Andrea Giorgi', 'Stefano Moscadelli']","[{'type': 'OTHER', 'identifier': 'STANFORD:36105115348455'}]"
792,Foschi P.,"Organizzazione politica ed ecclesiastica, insediamento ed economia nel territorio...di Ozzano...",,,"[{'type': 'OTHER', 'identifier': 'OCLC:848981897'}]"
793,Foschi U.,Il palazzo del Collegio a San Michele,,['Giuseppe Castellazzi'],"[{'type': 'OTHER', 'identifier': 'UCAL:C2684335'}]"
794,Granello di Casaleto G.,Scopolo,,,"[{'type': 'OTHER', 'identifier': 'ONB:+Z86194904'}]"
795,Da S. Luigi I.,Delizie degli eruditi toscani,,['Ildefonso di San Luigi (fra)'],"[{'type': 'OTHER', 'identifier': 'COLUMBIA:0021800197'}]"
796,Lazzari T.,Le origini della rocca,,,"[{'type': 'OTHER', 'identifier': 'OCLC:956190647'}]"
797,Linguerri P. S.,Cenni storici sulla valle del Senio del notaro in Casola residente Pietro Salvadore Linguerri Ceroni 1828,,['Pietro Salvatore Linguerri Ceroni'],"[{'type': 'OTHER', 'identifier': 'OCLC:963462988'}]"
798,Lodovici M.,La memoria e l'oblio: Serra e Tornano: due comunità dell'Appennino Romagnolo tra passato e presente,,['Dianella Gagliani'],"[{'type': 'OTHER', 'identifier': 'UOM:39015042929680'}]"
799,Lunig J.,Codex Italiae diplomatius,,['Massimo Panebianco'],"[{'type': 'ISBN_10', 'identifier': '8863428522'}, {'type': 'ISBN_13', 'identifier': '9788863428520'}]"
800,Machiavelli N.,Istorie fiorentine,,['Bernardo Segni'],"[{'type': 'OTHER', 'identifier': 'IBNF:CF990960005'}]"
801,,"Storia di Ravenna. IV, Dalla dominazione veneziana alla conquista francese",8831760742,,"[{'type': 'OTHER', 'identifier': 'STANFORD:36105010481088'}]"
802,Lazzari T.,"""Comitato"" senza città: Bologna e l'aristocrazia del territorio, nei secoli IX-XI",883956151x,['Tiziana Lazzari'],"[{'type': 'ISBN_10', 'identifier': '883956151X'}, {'type': 'ISBN_13', 'identifier': '9788839561510'}]"
803,Lazzari T.,Comunità rurali e potere signorile nell'Appennino bolognese: il dominio dei conti Alberti,,,"[{'type': 'OTHER', 'identifier': 'UOM:39015041018774'}]"
804,Foschi U.,La villa Ginanni-Corradini di Campiano ed altre ville minori della zona,,,"[{'type': 'OTHER', 'identifier': 'UCAL:$C159595'}]"
805,Foschi U.,La torre Albicini di San Pietro in Trento,,['Giordana Trovabene'],"[{'type': 'OTHER', 'identifier': 'UOM:39015050265183'}]"
808,,Statuta Communis Parmae ab anno 1266 ad annum circiter 1304,,,"[{'type': 'OTHER', 'identifier': 'UBBS:UBBS-00070670'}]"
809,Pezzana A.,Storia della città di Parma. I,,['Angelo Pezzana'],"[{'type': 'OTHER', 'identifier': 'UCLA:L0070630033'}]"
810,Pezzana A.,Storia della città di Parma. II,,['Ireneo Affò'],"[{'type': 'OTHER', 'identifier': 'NKP:1002394677'}]"
811,Pezzana A.,Storia della città di Parma. IV,,['Angelo Pezzana'],"[{'type': 'OTHER', 'identifier': 'HARVARD:HNPVIC'}]"
812,"Bellei S., Rovatti E.",Castelli Modenesi della Pianura,,"['Elena Grandi', 'Provincia Modena']","[{'type': 'ISBN_13', 'identifier': '9788878145863'}, {'type': 'ISBN_10', 'identifier': '8878145866'}]"
813,Sanuto M.,Diarii di Marino Sanuto,,['Marino Sanudo'],"[{'type': 'OTHER', 'identifier': 'HARVARD:32044058272907'}]"
814,Santini P.,Nuovi documenti dell'antica costituzione del comune di Firenze,,['Pietro Santini'],"[{'type': 'OTHER', 'identifier': 'OCLC:878800515'}]"
815,"Sanudo M., il Giovane",I diarii: 1496-1533: pagine scelte,8873054625,['Marino Sanudo'],"[{'type': 'OTHER', 'identifier': 'NWU:35556030032999'}]"
816,,Il Registrum Magnum del Comune di Piacenza. Documenti n. 1-273,8814002525,,"[{'type': 'OTHER', 'identifier': 'LCCN:85216085'}]"
817,,Il Registrum Magnum del Comune di Piacenza. Documenti n. 274-647,8814007608,['Piacenza (Italy)'],"[{'type': 'OTHER', 'identifier': 'UOM:39015032568654'}]"
818,,Rocche e castelli di Romagna. III,8886946554,['Andrea Fiorini'],"[{'type': 'ISBN_13', 'identifier': '9788878149496'}, {'type': 'ISBN_10', 'identifier': '8878149497'}]"
819,Boccia A.,Viaggio ai monti di Parma,,['Antonio Boccia'],"[{'type': 'OTHER', 'identifier': 'UVA:X002590457'}]"
820,"Bolzani G., Bolzani P.",La rocca Brancaleone a Ravenna: conoscenza e progetto,,"['Giampaolo Bolzani', 'Paolo Bolzani']","[{'type': 'ISBN_10', 'identifier': '8871892356'}, {'type': 'ISBN_13', 'identifier': '9788871892351'}]"
821,Bonacini P.,"Il ""Registrum Comunis Mutine"": 1299: politica e amministrazione corrente del comune di Modena",,['Pierpaolo Bonacini'],"[{'type': 'OTHER', 'identifier': 'UOM:39015060581298'}]"
822,Bonoli P.,Istoria della Città di Forlì,,['Paolo Bonoli'],"[{'type': 'OTHER', 'identifier': 'BSB:BSB10051583'}]"
823,Bonoli P.,Storia di Forlì scritta da Paolo Bonoli distinta in dodici libri corretta ed arricchita di nuove annotazioni,,,"[{'type': 'OTHER', 'identifier': 'IBNF:CF005857485'}]"
824,Burchi P.,Regesto degli atti del notaio sarsinate Domenico da Firenzuola (1403-1419),,"['Società di studi romagnoli', 'Paolo Enrico Arias']","[{'type': 'OTHER', 'identifier': 'UCAL:B4583764'}]"
825,Artocchini C.,L'architettura castrense nel contado piacentino,,['Andrea Fiorini'],"[{'type': 'ISBN_13', 'identifier': '9788878149496'}, {'type': 'ISBN_10', 'identifier': '8878149497'}]"
826,Perogalli C.,Castelli e Rocche di Emilia e Romagna,,['Carlo Perogalli'],"[{'type': 'OTHER', 'identifier': 'LCCN:73038574'}]"
827,Capacchi G.,Castelli della collina parmigiana,,['Guglielmo Capacchi'],"[{'type': 'OTHER', 'identifier': 'LCCN:80462754'}]"
828,Capacchi G.,Castelli della montagna parmigiana,,['Guglielmo Capacchi'],"[{'type': 'OTHER', 'identifier': 'LCCN:78339367'}]"
829,Capacchi G.,Castelli della pianura parmigiana,,['Guglielmo Capacchi'],"[{'type': 'OTHER', 'identifier': 'STANFORD:36105031509347'}]"
830,Castagnoli P. ?,La signoria di Galeazzo Visconti 1313-1322,,,"[{'type': 'OTHER', 'identifier': 'NWU:35556032611691'}]"
831,Castagnoli P.,Il governo del legato pontificio cardinale Bertrando del Poggeto 1322-1336,,,"[{'type': 'OTHER', 'identifier': 'NWU:35556032611691'}]"
832,Cencetti G.,L'autenticità di alcuni privilegi della Chiesa ravennate e la giurisdizione sull'abbazia di S. Ellero in Galeata,,['Giorgio Cencetti'],"[{'type': 'OTHER', 'identifier': 'OCLC:493563669'}]"
833,Cavalcanti G.,Istorie fiorentine,,['Bernardo Segni'],"[{'type': 'OTHER', 'identifier': 'IBNF:CF990960005'}]"
834,Cherubini G.,Una comunità dell'Appennino dal XIII al XV secolo:  Montecoronaro dalla signoria dell'abbazia del Trivio al dominio di Firenze,,['Giovanni Cherubini'],"[{'type': 'OTHER', 'identifier': 'STANFORD:36105041432639'}]"
835,Cristiani E.,Una vicenda dell'eredità matildina nel contado bolognese: il feudo dei nobili Andalò sulla pieve,,['Emilio Cristiani'],"[{'type': 'OTHER', 'identifier': 'OCLC:878634152'}]"
836,Mini G.,"La Romagna toscana: notizie geografiche, storiche, industriali e commerciali",,"['Giovanni Mini', 'Pompeo Nadiani']","[{'type': 'OTHER', 'identifier': 'OCLC:700315517'}]"
837,Mita D.,Sull'origine e sulle gesta della famiglia Ceroni,,"['Francesco Zambrini', 'Giosuè Carducci']","[{'type': 'OTHER', 'identifier': 'UOM:39015067392400'}]"
839,Mittarelli G. B.,Ad scriptores rerum italicarum cl. Muratorii accessiones Faventinae,,,"[{'type': 'OTHER', 'identifier': 'IBNF:CF005790620'}]"
840,Molossi L.,"Vocabolario topografico dei ducati di Parma, Piacenza e Guastalla",,['Lorenzo Molossi'],"[{'type': 'OTHER', 'identifier': 'UCAL:B2793557'}]"
841,Muratori L. A.,Delle antichità estensi ed italiane,,['Lodovico Antonio Muratori'],"[{'type': 'OTHER', 'identifier': 'BCUL:1092626710'}]"
842,Musso G.,Chronicon Placentinum ab anno CCXXII ad annum MCCCII,,['Daniele Andreozzi'],"[{'type': 'OTHER', 'identifier': 'UOM:39015035023038'}]"
843,Luxardo de Franchi N.,Il castello di monte Corneto in val di Ceno,,['Fabio Saggioro'],"[{'type': 'ISBN_13', 'identifier': '9788892850651'}, {'type': 'ISBN_10', 'identifier': '8892850652'}]"
844,Novelli L.,Due monasteri dedicati agli apostoli Pietro e Paolo nelle diocesi di Ravenna e Rimini,,['Giuseppe Vaccarini'],"[{'type': 'ISBN_13', 'identifier': '9788869272561'}, {'type': 'ISBN_10', 'identifier': '8869272567'}]"
845,Ferri A.,Genealogie delle famiglie nobili imolesi,,,"[{'type': 'OTHER', 'identifier': 'WISC:89100040328'}]"
846,Fasano Guarini E.,Lo Stato mediceo di Cosimo I,,['Elena Fasano Guarini'],"[{'type': 'OTHER', 'identifier': 'UOM:39015026679822'}]"
847,Foschi P.,"La famiglia dei conti di Panico, una signoria feudale fra Toscana ed Emilia",,['Edoardo Manarini'],"[{'type': 'ISBN_13', 'identifier': '9788855260114'}, {'type': 'ISBN_10', 'identifier': '8855260111'}]"
848,Casamorata C.,Il castello di Casamurata,,['Cesare Casamorata'],"[{'type': 'OTHER', 'identifier': 'OCLC:887235979'}]"
849,Casamorata C.,Il castello di Casamurata,,['Cesare Casamorata'],"[{'type': 'OTHER', 'identifier': 'OCLC:887235979'}]"
850,Casamorata C.,Il castello di Casamurata,,['Cesare Casamorata'],"[{'type': 'OTHER', 'identifier': 'OCLC:887235979'}]"
851,Casini L.,Il contado bolognese durante il periodo comunale (secoli XII-XV),,['Luigi Casini'],"[{'type': 'OTHER', 'identifier': 'CHI:42787520'}]"
852,Lami G.,Sanctae Ecclesiae Florentinae Monumenta,,['Giovanni Lami'],"[{'type': 'OTHER', 'identifier': 'ONB:+Z164860108'}]"
853,Pasolini P. D.,La battaglia di Ravenna: 11 aprile 1512,,"['Eraldo Baldini', 'Norino Cani', 'Pietro Compagni', 'Girolamo Rossi']","[{'type': 'ISBN_10', 'identifier': '888063710X'}, {'type': 'ISBN_13', 'identifier': '9788880637103'}]"
