IdBibliografia,Autore,Titolo,ISBN,new_authors,new_identifier
347,Babini A. F.,Dalla bastia dello Zaniolo alla Bastia di Ca' di Lugo,,['Angelo Francesco Babini'],"[{'type': 'OTHER', 'identifier': 'UCAL:B2836276'}]"
348,Bacchi G.,Tossignano: storia di un paese distrutto,,['Giuseppe Maria Bacchi'],"[{'type': 'OTHER', 'identifier': 'OCLC:878877167'}]"
349,Bacchini A.,"Sissa: una storia, un paese",,['Alberto Bacchini'],"[{'type': 'OTHER', 'identifier': 'LCCN:75570803'}]"
350,Baldisserri L.,Il castello di Mordano,,['Luigi Baldisserri'],"[{'type': 'OTHER', 'identifier': 'OCLC:252260127'}]"
351,Baldisserri L.,Bagnara di Romagna,,['Ernesto Casadio'],"[{'type': 'OTHER', 'identifier': 'UVA:X002250769'}]"
352,Baldisserri L.,I brunori della valle del Senio,,['Luigi Baldisserri'],"[{'type': 'OTHER', 'identifier': 'OCLC:1151715760'}]"
353,Machiavelli N.,Legazioni e commissarie,,['Niccolò Machiavelli'],"[{'type': 'OTHER', 'identifier': 'IBNF:CF990948649'}]"
354,Malispini R.,Storia fiorentina,,['Benedetto Varchi'],"[{'type': 'OTHER', 'identifier': 'KBNL:KBNL03000141863'}]"
355,,Per la storia del castello di Montarsiccio,,['Felice (da Mareto)'],"[{'type': 'OTHER', 'identifier': 'UVA:X002599648'}]"
356,Coleti D.,Notizie storiche della chiesa di San Pietro in Silvis,,['Ignazio Guglielmo Graziani'],"[{'type': 'OTHER', 'identifier': 'BSB:BSB10005136'}]"
357,Colombi B.,Soragna feudo e comune,,,"[{'type': 'OTHER', 'identifier': 'OCLC:930397694'}]"
358,Contarini E.,Le mura che cingevano Bagnacavallo,,['Ettore Contarini'],"[{'type': 'OTHER', 'identifier': 'OCLC:964270662'}]"
359,Corradini C.,"Tra Quarantoli e Reggio Emilia: la domus dei figli di Manfredo, la familia dei Manfredi, il comune",,"['Bruno Andreolli', 'Mauro Calzolari']","[{'type': 'OTHER', 'identifier': 'UOM:39015069304189'}]"
360,Coronelli V.,"Ravenna ricercata antico moderna, accresciuta di memorie ed ornata di copiose figure",,['Vincenzo Maria Coronelli'],"[{'type': 'OTHER', 'identifier': 'OCLC:955828986'}]"
361,Corradini E.,Tutela e conservazione del patrimonio storico-artistico del periodo post-unitario: il castello delle,,"['Marta Bottero', 'Chiara Devoti']","[{'type': 'ISBN_13', 'identifier': '9788892851580'}, {'type': 'ISBN_10', 'identifier': '8892851586'}]"
362,Corni G.,Il castello di Monfestino e il suo territorio,,['Guido Corni'],"[{'type': 'OTHER', 'identifier': 'OCLC:35234115'}]"
363,Cortesi G.,Alla ricerca del porto di Classe. Note di storia e di archeologia,,['Giovanna Bermond Montanari'],"[{'type': 'OTHER', 'identifier': 'STANFORD:36105032776689'}]"
364,Cortesi G.,Alla ricerca del porto di Classe. Notizie di antica topografia classicana,,['Giuseppe Cortesi'],"[{'type': 'OTHER', 'identifier': 'UOM:39015041202436'}]"
365,Cortesi G.,Recenti scoperte archeologiche nella zona di Classe,,['Deborah Mauskopf Deliyannis'],"[{'type': 'ISBN_13', 'identifier': '9780521836722'}, {'type': 'ISBN_10', 'identifier': '0521836727'}]"
366,Cortini G.,Brevi notizie storiche sul comune di Casalfiumanese,,['Giuseppe Fortunato Cortini'],"[{'type': 'OTHER', 'identifier': 'OCLC:887014906'}]"
367,Cortini G.,Linaro in comune d'Imola,,['Giuseppe Fortunato Cortini'],"[{'type': 'OTHER', 'identifier': 'OCLC:797380650'}]"
368,,Appendice ai Monumenti ravennati dei secoli di mezzo del conte Marco Fantuzzi,,['Antonio Tarlazzi'],"[{'type': 'OTHER', 'identifier': 'COLUMBIA:0036749460'}]"
369,,Cronica di Buonaccorso Pitti con annotazioni,,['Bonaccorso Pitti'],"[{'type': 'OTHER', 'identifier': 'IBNF:CF005809782'}]"
370,,La Descriptio civitatis Bononie eiusque comitatus del cardinale Anglico (1371): introduzione ed edizione critica,,"['Anglic de Grimoard', 'Rolando Dondarini']","[{'type': 'OTHER', 'identifier': 'OCLC:27280191'}]"
371,,Diplomata regum et imperatorum Germaniae,,['Monumenta Germaniae Historica (München)'],"[{'type': 'OTHER', 'identifier': 'OCLC:163408830'}]"
372,,I capitoli del comune di Firenze. Inventario e regesto,,['Cesare Guasti'],"[{'type': 'OTHER', 'identifier': 'BSB:BSB11500898'}]"
373,,In agro Decimano. Per un catalogo del patrimonio storico archeologico del territorio a sud di Ravenna,,"['Marilisa Ficara', 'Valentina Manzelli']","[{'type': 'ISBN_13', 'identifier': '9788878143883'}, {'type': 'ISBN_10', 'identifier': '887814388X'}]"
374,,Il Registrum Magnum del Comune di Piacenza,,,"[{'type': 'ISBN_10', 'identifier': '8814002525'}, {'type': 'ISBN_13', 'identifier': '9788814002526'}]"
375,,Insediamento storico e beni culturali,,,"[{'type': 'OTHER', 'identifier': 'OCLC:159825290'}]"
376,,Insediamento storico e beni culturali nel territorio del comune di Monterenzio,,"['Andrea Cardarelli', 'Luigi Malnati']","[{'type': 'ISBN_13', 'identifier': '9788878143180'}, {'type': 'ISBN_10', 'identifier': '8878143189'}]"
377,Ammirato S.,Istorie Fiorentine di Scipione Ammirato con l'aggiunte di Scipione Ammirato il Giovane,,['Scipione Ammirato'],"[{'type': 'OTHER', 'identifier': 'OCLC:456794699'}]"
378,,Konrad bestatigt dem Kloster des h. Donatus bei Imola seine Besitzungen,,"['Holy Roman Empire. Emperor (1024-1039 : Conrad II)', 'Conrad II ((empereur germanique ;)']","[{'type': 'OTHER', 'identifier': 'STANFORD:36105027845887'}]"
380,,"La città dei ""divini alberi"". Cervia e la sua rappresentazione nei secoli",,,"[{'type': 'OTHER', 'identifier': 'OCLC:42798643'}]"
381,,Le antiche pievi della città di Imola,,['Angelo Tafi'],"[{'type': 'OTHER', 'identifier': 'UOM:39015042786155'}]"
382,,Le carte bolognesi del secolo XI,,"['Giovanni Feo', 'Maddalena Modesti', 'Mario Fanti']","[{'type': 'OTHER', 'identifier': 'UOM:39015064102489'}]"
384,,Monastero di S. Giacomo di Bologna,,"[""Biblioteca comunale dell'Archiginnasio (Bologna, Italy)"", 'Luigi Frati']","[{'type': 'OTHER', 'identifier': 'NYPL:33433082483722'}]"
385,,Monastero di S. Stefano,,['Giuseppe Umberto Fracchia'],"[{'type': 'OTHER', 'identifier': 'OCLC:1035971803'}]"
386,,Le Liber Pontificalis,,,"[{'type': 'OTHER', 'identifier': 'NWU:35556016513640'}]"
387,,Le carte del monastero di S. Maria di Montepiano (1000-1200),,"['Churches and Institutions (MARY, the Blessed Virgin). Montepiano. Monastero di S. Maria', 'Renato PIATTOLI']","[{'type': 'OTHER', 'identifier': 'OCLC:562879486'}]"
388,,Le carte del monastero di S. Salvatore di Vaiano (1119-1260),,"['Monastero di S. Salvatore (Vaiano, Italy)', 'Renzo Fantappiè']","[{'type': 'OTHER', 'identifier': 'OCLC:20223057'}]"
389,,Le consulte e pratiche della Repubblica fiorentina (1404),,['Firenze (Repubblica)'],"[{'type': 'OTHER', 'identifier': 'OCLC:956122294'}]"
390,,Le consulte e pratiche della Repubblica fiorentina (1405-1406),,['Laura De Angelis Cappabianca'],"[{'type': 'OTHER', 'identifier': 'UOM:39015040695598'}]"
391,,Le consulte e pratiche della Repubblica fiorentina (1498-1505),,['Denis Fachard'],"[{'type': 'OTHER', 'identifier': 'UOM:39015029933432'}]"
392,,Le consulte e pratiche della Repubblica fiorentina nel Quattrocento (1401),,,"[{'type': 'OTHER', 'identifier': 'OCLC:832469263'}]"
393,,Liber Censuum Comunis Pistorii,,['Pistoia (Italy)'],"[{'type': 'OTHER', 'identifier': 'PRNC:32101074754761'}]"
394,,Memoriali del comune bolognese,,['Guido Zaccagnini'],"[{'type': 'OTHER', 'identifier': 'OCLC:500438013'}]"
395,,Mirabilia. Guida per le scuole alle cose straordinarie di Ravenna,,"['Donatella Mazza', 'Vittorio Pranzini']","[{'type': 'OTHER', 'identifier': 'OCLC:28160018'}]"
396,,Monastero di S. Salvatore di Fontana Taona secoli XI e XII,,['V. Torelli Vignali'],"[{'type': 'ISBN_10', 'identifier': '8866120081'}, {'type': 'ISBN_13', 'identifier': '9788866120087'}]"
397,,Monastero di Sant'Agnese,,['Isa Lori Sanfilippo'],"[{'type': 'ISBN_10', 'identifier': '8897808441'}, {'type': 'ISBN_13', 'identifier': '9788897808442'}]"
399,,Notiziario. Scavi al Ponte Marino,,,"[{'type': 'OTHER', 'identifier': 'IND:30000092031560'}]"
400,,"Prontuario illustrato per la denominazione delle piazze, vie e vicoli e per la numerazione dei fabbricati della città di Ravenna, attivato al 1 gennaio 1882 in esecuzione alla deliberazione del Consiglio Comunale 14 ottobre 1881",,['Biblioteca nazionale centrale di Firenze'],"[{'type': 'OTHER', 'identifier': 'STANFORD:36105118912869'}]"
401,,Ranchio: vita e storia di una comunità,,,"[{'type': 'OTHER', 'identifier': 'OCLC:955877164'}]"
402,,Regesto di S. Apollinare Nuovo,,,"[{'type': 'OTHER', 'identifier': 'NYPL:33433081863452'}]"
403,,Respublica Mutinensis (1306-1307),,['Modena (Italy)'],"[{'type': 'OTHER', 'identifier': 'OCLC:78842108'}]"
404,,Respublica Mutinensis (1306-1307),,['Modena (Italy)'],"[{'type': 'OTHER', 'identifier': 'OCLC:78842108'}]"
405,,Rocche e castelli di Romagna. II,888694652x,,"[{'type': 'OTHER', 'identifier': 'STANFORD:36105003731507'}]"
406,,Statuti di Bologna dell'anno 1288,,['Bologna'],"[{'type': 'OTHER', 'identifier': 'UVA:X000712382'}]"
407,,Spicilegium Ravennatis Historiae,,['Pietro Paolo Ginanni'],"[{'type': 'OTHER', 'identifier': 'BSB:BSB10679231'}]"
408,,Statuta populi et communis Florentiae,,"['Firenze', 'Firenze Ducato']","[{'type': 'OTHER', 'identifier': 'IBNN:BN001407688'}]"
409,,Statuto della città: 1334,,['Giuseppe Salvioli'],"[{'type': 'OTHER', 'identifier': 'HARVARD:32044059167387'}]"
410,,Statuto del secolo XIII del Comune di Ravenna,,"['Ravenna', 'Silvio Bernicoli']","[{'type': 'OTHER', 'identifier': 'UCAL:$C159576'}]"
411,Venturi S.,Castelli bolognesi dall'età comunale alla signoria,8836602282,['Giuseppe Adani'],"[{'type': 'OTHER', 'identifier': 'UVA:X001731775'}]"
413,,Chronicon Estense: gesta Marchionum estensium complectes ab anno 1101 usque ad annum 1354,,['ESTE CHRONICLE.'],"[{'type': 'OTHER', 'identifier': 'OCLC:560743480'}]"
415,Arata A.,"Il ""castrum"", la chiesa e due antiche pergamene di Vigoleno",,,"[{'type': 'OTHER', 'identifier': 'SRLF:A0002167781'}]"
416,Ardizzoni F.,Antichità presunte e reali di Galliera,,['Stefano Cremonini'],"[{'type': 'OTHER', 'identifier': 'UOM:39015062460251'}]"
417,,Archivio Ducale Sforzesco Registro delle Missive,,['Archivio di Stato di Milano'],"[{'type': 'OTHER', 'identifier': 'OCLC:10467625'}]"
418,Artocchini C.,Il castello di Cariseto in Val d'Aveto,,,"[{'type': 'OTHER', 'identifier': 'UCAL:$B518984'}]"
419,Balduzzi L.,Arma di Cotignola,,,"[{'type': 'OTHER', 'identifier': 'HARVARD:32044095335501'}]"
420,Randi A.,I monumenti di Ravenna: breve guida con venti illustrazioni e pianta,,['Biblioteca nazionale centrale di Firenze'],"[{'type': 'OTHER', 'identifier': 'STANFORD:36105118912869'}]"
421,Agostinelli E. R.,L'architettura,,['Franco Purini'],"[{'type': 'ISBN_13', 'identifier': '9788849253542'}, {'type': 'ISBN_10', 'identifier': '8849253540'}]"
422,Ammirato S.,Istorie fiorentine,,['Bernardo Segni'],"[{'type': 'OTHER', 'identifier': 'IBNF:CF990960005'}]"
423,,Annales caesenates,,['Gherardo Ortalli'],"[{'type': 'OTHER', 'identifier': 'STANFORD:36105038828492'}]"
424,Angiolini E.,Gli Annales Caesenates: proposta di edizione critica. Tesi dattiloscritta,,"['Antonio Montefusco', 'Giuliano Milani']","[{'type': 'ISBN_13', 'identifier': '9783110590739'}, {'type': 'ISBN_10', 'identifier': '3110590735'}]"
425,Artocchini C.,L'architettura castrense,,['Luigi Canina'],"[{'type': 'OTHER', 'identifier': 'WISC:89056270390'}]"
426,Artocchini C.,Castellaro Arcelli,,['Federico Arcelli'],"[{'type': 'ISBN_13', 'identifier': '9788849813197'}, {'type': 'ISBN_10', 'identifier': '8849813198'}]"
427,Artocchini C.,Castelli piacentini,,['Carmen Artocchini'],"[{'type': 'OTHER', 'identifier': 'OCLC:29283993'}]"
428,Artocchini C.,I castelli piacentini. Lo Stato Landi. Lo Stato Pallavicino,,,"[{'type': 'OTHER', 'identifier': 'UCLA:L0066440959'}]"
429,Rossini G.,Un'antica controversia per il possesso di Lugo e di S. Potito,,,"[{'type': 'OTHER', 'identifier': 'UOM:39015072471173'}]"
430,Rossini G.,Schedario cronologico,,,"[{'type': 'OTHER', 'identifier': 'IBNR:CR300102752'}]"
431,Rossi M.,Alberto III Pio e l'umanesimo a Carpi,8843568655,['Manuela Kahn-Rossi'],"[{'type': 'OTHER', 'identifier': 'STANFORD:36105121306349'}]"
432,Rossi M.,Carpi e il castello dei Pio,8843568655,"['Manuela Kahn-Rossi', 'Elena Svalduz']","[{'type': 'OTHER', 'identifier': 'STANFORD:36105115338571'}]"
433,Rossi S.,La rocca di San Secondo,,,"[{'type': 'OTHER', 'identifier': 'OCLC:955753947'}]"
434,"Rotelli E., Piacentini R.",Storia di Sassuolo. Dalle origini alla fine della Signoria Pio,,"['Elena Rotelli', 'Rosanna Piacentini']","[{'type': 'ISBN_10', 'identifier': '8889080094'}, {'type': 'ISBN_13', 'identifier': '9788889080092'}]"
435,"Maggi S., Artocchini C.",I castelli del piacentino nella storia e nella leggenda,,"['Serafino Maggi', 'Carmen Artocchini']","[{'type': 'OTHER', 'identifier': 'LCCN:71350453'}]"
436,Soranzo G.,La guerra fra Venezia e la S. Sede per il dominio di Ferrara: (1308-1313),,['Giovanni SORANZO (Historian.)'],"[{'type': 'OTHER', 'identifier': 'OCLC:503882332'}]"
437,Soranzo G.,L'Antico Navigabile Po di Primaro nella Vita Economica e Politica del Delta Padano,,['Giovanni Soranzo'],"[{'type': 'OTHER', 'identifier': 'LCCN:77239338'}]"
438,Soriani G. A.,Notizie storiche di Fusignano,,['Leone Vicchi'],"[{'type': 'OTHER', 'identifier': 'BL:A0026494694'}]"
439,Soriani G. A.,Supplemento storico sulla origine e progressi della città di Lugo,,['Giuseppe Antonio Soriani'],"[{'type': 'OTHER', 'identifier': 'OCLC:886289973'}]"
440,Solieri G.,L'antica casa degli Attendoli Sforza in Cotignola e gli uomini illustri cotignolesi,,['Gaetano Solieri'],"[{'type': 'OTHER', 'identifier': 'OCLC:799480092'}]"
441,Solieri G.,Le origini e la dominazione degli Sforza a Cotignola: appunti storici,,['Gaetano Solieri'],"[{'type': 'OTHER', 'identifier': 'OCLC:799480074'}]"
442,Simoni G.,Notizie storiche di taluni castelli distrutti nelle vallate del Sillaro e dell'Idice,,"['Deputazione di storia patria per le provincie di Romagna, Bologna']","[{'type': 'OTHER', 'identifier': 'UVA:X030527899'}]"
443,Serantini F.,Un documento inedito sulla fondazione di Castelbolognese,,['Enrica Zambelli'],"[{'type': 'OTHER', 'identifier': 'UOM:39015049674958'}]"
444,"Sercambi G., Lucchese",Le Croniche,,['Giovanni Sercambi'],"[{'type': 'OTHER', 'identifier': 'RMS:RMSIRFM$000002716$$$U'}]"
445,Servetti Donati F.,"Il ""paese del fiume"". Appunti per una storia del territorio (secoli XI-XVIII)",,,"[{'type': 'OTHER', 'identifier': 'STANFORD:36105011899452'}]"
446,Poggiali C.,Memorie storiche di Piacenza compilate dal preposto Cristoforo Poggiali bibliotecario di S.A.R.. IV,,['Cristoforo Poggiali'],"[{'type': 'OTHER', 'identifier': 'BML:37001102073447'}]"
447,Corna A. C./P. ?,Castelli e rocche del Piacentino,,['Andrea Corna (OFM)'],"[{'type': 'OTHER', 'identifier': 'OCLC:878294229'}]"
448,Caggese R.,Il comune rurale di Tredozio,,,"[{'type': 'OTHER', 'identifier': 'OCLC:1404555292'}]"
449,Calandrini S.,"San Mauro, Giovedia, la Torre. S. Mauro e Giovedia dall'Alto Medioevo al Settecento: la tenuta Torre dal 1700 al 1917",,"['Marino Mengozzi', 'Claudio Riva']","[{'type': 'OTHER', 'identifier': 'UOM:39015063289899'}]"
450,Calindri S.,Dizionario corografico della montagna e collina del territorio bolognese,,['Serafino Calindri'],"[{'type': 'OTHER', 'identifier': 'IBNR:CR102019808'}]"
451,Calzolari M.,Aspetti topografici e urbanistici della fondazione del nuovo Finale (1213),,,"[{'type': 'OTHER', 'identifier': 'UOM:39015056655486'}]"
452,Calzolari M.,Insediamenti altomedievali nella pianura tra Secchia e Panaro ?,,['Enrico Maragno'],"[{'type': 'OTHER', 'identifier': 'STANFORD:36105022382886'}]"
453,Calzolari M.,L'area archeologica di Santo Stefano di Concordia (MO): inquadramento topografico,,['Graziano Mario Valenti'],"[{'type': 'ISBN_13', 'identifier': '9788898533459'}, {'type': 'ISBN_10', 'identifier': '8898533454'}]"
454,Calzolari M.,Prima delle fonti scritte. Il contributo dei toponimi alla storia degli insediamenti romani e medievali,,['Bruno Andreolli'],"[{'type': 'OTHER', 'identifier': 'UOM:39015045663807'}]"
455,Calzolari M.,"Prime indicazioni per una lettura del territorio fra Bomporto, Ravarino, Crevalcore e Camposanto",,,"[{'type': 'OTHER', 'identifier': 'UOM:39015056655486'}]"
456,Campagnoli P.,Le torri di via terrapieni a S. Felice sul Panaro,,"['Elena Grandi', 'Provincia Modena']","[{'type': 'ISBN_13', 'identifier': '9788878145863'}, {'type': 'ISBN_10', 'identifier': '8878145866'}]"
457,Campari F. L.,"Un castello del Parmigiano attraverso i secoli. Pallavicini, Rossi e Rangoni",,['Francesco Luigi Campari'],"[{'type': 'OTHER', 'identifier': 'OCLC:877985157'}]"
458,Campi P. M.,Della historia ecclesiastica di Piacenza,,['Pietro Maria Campi'],"[{'type': 'OTHER', 'identifier': 'IBNN:BNA01001470234'}]"
459,Campi P. M.,Dell'historia ecclesiastica di Piacenza,,['Pietro Maria Campi'],"[{'type': 'OTHER', 'identifier': 'IBNN:BNA01001470234'}]"
460,Capozzi F.,Sul castello di Mordano. Memorie Istoriche,,,"[{'type': 'OTHER', 'identifier': 'OCLC:908542619'}]"
461,Caprara E.,Gli insediamenti medievali attraverso la cartografia moderna,,,"[{'type': 'OTHER', 'identifier': 'STANFORD:36105040754926'}]"
462,Casadei E.,"La città di Forlì e i suoi dintorni: guida storico-artistica della città di Forlì, Forlimpopoli, Bertinoro",,['Ettore Casadei'],"[{'type': 'OTHER', 'identifier': 'UCAL:B2832737'}]"
463,"Casadei M., Buda A.",Parrocchie e chiese nel corianese,,"['Maurizio Casadei', 'Alessandro Buda']","[{'type': 'OTHER', 'identifier': 'LCCN:2008372259'}]"
464,Casella M.,Del comitato auciense,,['Francesco Nicolli'],"[{'type': 'OTHER', 'identifier': 'ONB:+Z185496005'}]"
465,Casini T.,Scritti danteschi: con due facsimili e con documenti inediti,,['Tommaso Casini'],"[{'type': 'OTHER', 'identifier': 'OXFORD:302914292'}]"
466,Castagnoli P.,Il comune podestarile,,['Francesco Lanzani'],"[{'type': 'OTHER', 'identifier': 'EHC:148101005613U'}]"
467,Casini S.,Dizionario biografico geografico storico del Comune di Firenzuola,,['Stefano Casini'],"[{'type': 'OTHER', 'identifier': 'HARVARD:32044019910306'}]"
468,Castagnoli P.,Gian Galeazzo duca di Milano e il suo progetto di unificazione italiana,,['Jean-Claude Maire Vigueur'],"[{'type': 'OTHER', 'identifier': 'NWU:35556032611691'}]"
469,Castagnoli P.,Dal governo di Azzone all'ascesa al potere di Gian Galeazzo 1336-1385,,['Jean-Claude Maire Vigueur'],"[{'type': 'ISBN_13', 'identifier': '9788867282425'}, {'type': 'ISBN_10', 'identifier': '8867282425'}]"
470,Cecconi F.,Storia di San Pietro in Casale e di tutte le sue frazioni,,['Federico Cecconi'],"[{'type': 'ISBN_10', 'identifier': '8870371794'}, {'type': 'ISBN_13', 'identifier': '9788870371796'}]"
471,Cecilia A.,Marcabò,,['Dante Alighieri'],"[{'type': 'ISBN_10', 'identifier': '8883582446'}, {'type': 'ISBN_13', 'identifier': '9788883582448'}]"
472,Cavazza F.,Il castello di San Martino in Soverzano e i suoi antichi signori,,['Francesco Cavazza'],"[{'type': 'OTHER', 'identifier': 'OCLC:868832472'}]"
473,Cencetti G.,Le carte bolognesi del secolo X,,['Giorgio Cencetti'],"[{'type': 'OTHER', 'identifier': 'OCLC:269889398'}]"
474,Cerri L.,Il castello di Casasco e il palazzo del Comune,,['Cristoforo Poggiali'],"[{'type': 'OTHER', 'identifier': 'CHI:20517640'}]"
475,Cerri L.,Il castello di Montechiaro,,['Calogero Carità'],"[{'type': 'OTHER', 'identifier': 'OCLC:886926256'}]"
476,Cerri L.,La cittadella viscontea,,['Emilio Nasalli Rocca di Corneliano'],"[{'type': 'OTHER', 'identifier': 'OCLC:794288174'}]"
477,Chini L.,Storia del Mugello,,['Lino Chini'],"[{'type': 'OTHER', 'identifier': 'UCAL:$B515494'}]"
478,Chittolini G.,La signoria degli Anguissola su Riva Grazzano e Montesanto fra Trecento e Quattrocento,,['Sandro Carocci'],"[{'type': 'ISBN_13', 'identifier': '9791221501865'}]"
479,Clementini C.,Raccolto istorico della fondazione di Rimino e vite de' Malatesti,,['Cesare Clementini'],"[{'type': 'OTHER', 'identifier': 'IBNR:CR000651765'}]"
480,Clementini C.,Raccolto istorico della fondazione di Rimino e dell'origine e vite de' Malatesti,,['Cesare Clementini'],"[{'type': 'OTHER', 'identifier': 'IBNR:CR000651765'}]"
481,Cortini G. F.,Storia di Castel del Rio dalle origini all'anno 1932,,['Giuseppe Fortunato Cortini'],"[{'type': 'OTHER', 'identifier': 'OCLC:955397425'}]"
482,Cremonini P.,L'area suburbana di San Giovanni in Persiceto con i settori a frutteti e orti: Persiceta?,8849113978,,
483,"Dagli Alberi D., Pederzani G.",Il castello di Felino,,,"[{'type': 'OTHER', 'identifier': 'OCLC:955740698'}]"
484,,Memorie del castello e del Comune di Osta,,['Antonio Ricci'],"[{'type': 'OTHER', 'identifier': 'PRNC:32101068179355'}]"
485,Dall'Acqua M.,La rocca di Fontanellato,,,"[{'type': 'OTHER', 'identifier': 'OCLC:955740581'}]"
486,Dal Verme G.,Compendio della storia di Piacenza diviso in due parti. I,,['Giuseppe Dal Verme'],"[{'type': 'OTHER', 'identifier': 'OCLC:80001374'}]"
487,Dal Verme G.,Compendio della storia di Piacenza diviso in due parti. II,,,"[{'type': 'OTHER', 'identifier': 'IBNR:CR000716725'}]"
488,Delucca O.,Savignano fra XI e XV secolo,,['Enrico Angiolini'],"[{'type': 'OTHER', 'identifier': 'UOM:39015060583021'}]"
489,Denti N.,Fidenza dalle origini ai nostri giorni,,"['Amos Aimi', 'Aldo Copelli']","[{'type': 'OTHER', 'identifier': 'LCCN:84179357'}]"
490,Di Gropello G.,Il castello di Cereto Landi,,,"[{'type': 'ISBN_13', 'identifier': '9788878144330'}, {'type': 'ISBN_10', 'identifier': '8878144339'}]"
491,Diversi O.,Il territorio di Castelbolognese: raccolta di notizie e cronaca,,"['Mario Fanti', 'Deanna Lenzi']","[{'type': 'OTHER', 'identifier': 'UOM:39015038524008'}]"
492,Dodi L.,Il Torrione del Duca a Castell'Arquato,,['Giorgio Eremo'],"[{'type': 'OTHER', 'identifier': 'UOM:39015041551105'}]"
493,Domeniconi A.,Documenti relativi alla ricostruzione della rocca di Cesena dopo la fine della signoria malatestiana,,['Antonio Domeniconi'],"[{'type': 'OTHER', 'identifier': 'OCLC:1006176412'}]"
494,Bontempi A.,Rubbiano nei secoli,,['Corrado Ferretti'],"[{'type': 'OTHER', 'identifier': 'STANFORD:36105032851946'}]"
495,Donati L.,L'area solarolese dal X al XIV secolo,,['Enrica Zambelli'],"[{'type': 'OTHER', 'identifier': 'UOM:39015049674958'}]"
496,Dotti Messori G.,"Spezzano, una comunità, un castello",,['Gianna Dotti Messori'],"[{'type': 'OTHER', 'identifier': 'OCLC:955516506'}]"
497,Ercolani L.,"Vocabolario romagnolo-italiano, italiano-romagnolo",8875672377,['Libero Ercolani'],"[{'type': 'OTHER', 'identifier': 'UVA:X000509551'}]"
498,Eremo G.,Rocca d?Olgisio... Castrum et Villam Olzisii,,,
499,Esposito R.,Forme di Governo a Castel Guelfo in età medievale,8883420411,['Castel Guelfo di Bologna (Italy)'],"[{'type': 'ISBN_10', 'identifier': '8883420411'}, {'type': 'ISBN_13', 'identifier': '9788883420412'}]"
500,Rulli E.,Il castello di Compiano,,,"[{'type': 'OTHER', 'identifier': 'OCLC:955740601'}]"
501,Evangelisti G.,Castel d'Aiano e le sue frazioni: Roffeno e Casigno nella storia,,['Gino Evangelisti'],"[{'type': 'OTHER', 'identifier': 'OCLC:165601695'}]"
502,Evangelisti G.,L'antico castello di Roffeno nella sua problematica storica,,,"[{'type': 'OTHER', 'identifier': 'NWU:35556020633087'}]"
503,Fabretti A.,"L'architetto Giovan Battista Aleotti, regista dei Pio",,"['Ferdinando Taddei', 'Alessandra Chiarelli', 'Accademia di scienze, lettere e arti (Modena, Italy)']","[{'type': 'OTHER', 'identifier': 'STANFORD:36105121439157'}]"
504,Fanti M.,La storia di Minerbio,,['Camillo Zamboni'],"[{'type': 'OTHER', 'identifier': 'HARVARD:HNPVNM'}]"
505,Fantaguzzi G.,"""Caos"". Cronache Cesenati del sec. XV",,['Giuliano Fantaguzzi'],"[{'type': 'OTHER', 'identifier': 'OCLC:886366678'}]"
506,Fantini R.,Il Petrarca a Guardasone,,,"[{'type': 'OTHER', 'identifier': 'UCAL:B3058015'}]"
507,Samoggia L.,"Lo sviluppo urbanistico, il patrimonio architettonico e artistico",8883420411,['Castel Guelfo di Bologna (Italy)'],"[{'type': 'ISBN_10', 'identifier': '8883420411'}, {'type': 'ISBN_13', 'identifier': '9788883420412'}]"
508,Santini G.,Il castello di Formigine nell'ambito del sistema difensivo modenese,,['Pierpaolo Bonacini'],"[{'type': 'OTHER', 'identifier': 'STANFORD:36105024363157'}]"
509,Santucci F.,Cesenatico. Da porto di Cesena a Comune,,['Francesco Santucci'],"[{'type': 'OTHER', 'identifier': 'OCLC:797443523'}]"
510,Summer L.,La rocca di Borgonovo nel quadro evolutivo delle fortificazioni,,['Giuseppe Adani'],"[{'type': 'OTHER', 'identifier': 'UVA:X001731775'}]"
511,"Tamburini A., Cani N.",Lugo: archeologia di una città e di un territorio,,"['Anna Tamburini', 'Norino Cani']","[{'type': 'OTHER', 'identifier': 'LCCN:92141414'}]"
512,Grisenti F.,"Berceto, una finestra aperta sul passato",,['Franco Grisenti'],"[{'type': 'OTHER', 'identifier': 'OCLC:956172407'}]"
513,Grossi L.,Scoperte archeologiche nelle memorie scritte e a stampa nei secoli XVIII-XIX,,,"[{'type': 'OTHER', 'identifier': 'STANFORD:36105040754926'}]"
514,Guerra E.,Basilicanova nella storia civile e religiosa,,['Egidio Guerra'],"[{'type': 'OTHER', 'identifier': 'OCLC:956250004'}]"
515,Guerrieri D.,Scoprire e vivere 19 castelli del Ducato di Parma e Piacenza,,"['Giancarlo Bertuzzi', 'Nicoletta Perazzoli', 'Renzo Marchionni']","[{'type': 'OTHER', 'identifier': 'OCLC:930406825'}]"
516,Guerrini G.,La scultura nel Duecento e nel Trecento,,['Touring club italiano'],"[{'type': 'OTHER', 'identifier': 'UOM:39015015848313'}]"
517,Guidicini G.,Miscellanea Storico-Patria Bolognese tratta dai manoscritti di Giuseppe Guidicini,,['Giuseppe Guidicini'],"[{'type': 'OTHER', 'identifier': 'CORNELL:31924028368276'}]"
518,Schenoni Visconti G.,Appunti e note su fortificazioni in val Taro e val Ceno,,,"[{'type': 'ISBN_13', 'identifier': '9788878143821'}, {'type': 'ISBN_10', 'identifier': '8878143820'}]"
519,Schenoni Visconti G.,Fortilizi minori e sconosciuti dell'alto Taro e Ceno,,"[""Biblioteca di archeologia e storia dell'arte (Rome, Italy)""]","[{'type': 'OTHER', 'identifier': 'PSU:000005187904'}]"
520,,Il Castiglionese dei Pepoli: forme naturali e storiche della montagna,,['Paolo Guidotti'],"[{'type': 'ISBN_10', 'identifier': '8849111754'}, {'type': 'ISBN_13', 'identifier': '9788849111750'}]"
